Index,Role,Timestamp,Message
1,User,2026-04-02T09:12:18.813Z,"As a test please can you send me a way file with a test message?"
2,Assistant,,"Created WAV test-message.wav at C:\Users\MPhil\source\repos\personal-assistant\test-message.wav; synthesized 'This is a test message.'"
3,User,2026-04-02T09:13:31.789Z,"actually I wanted you to send it to me in telegram that's the bit I want to test basically I'm going to ask for or away file and then ask you for the text equivalent afterwards to see if it works savvy"
4,Assistant,,"Sent test-message.wav to Telegram; confirmed upload."
5,User,2026-04-02T09:14:18.004Z,"can you give me now a text representation of the wave file?"
6,Assistant,,"Transcript: 'This is a test message.'"
7,User,2026-04-02T09:14:59.872Z,"one thing that was different you didn't use the correct voice can we rectify that. please send me a test  wave file"
8,Assistant,,"Listed installed Windows TTS voices and asked user to pick one."
9,User,2026-04-02T09:16:11.618Z,"You should be using the ones off of azure cognitive services to create the way file otherwise you sound like a robot"
10,Assistant,,"Synthesized with Azure Cognitive Services (en-GB-LibbyNeural) to test-message-azure.wav; sent to Telegram."
11,User,2026-04-02T09:18:12.604Z,"Okay now can you give me a text representation of the last  wave file you sent me?"
12,Assistant,,"Transcript: 'This is a test message.'"
13,User,2026-04-02T09:18:49.116Z,"okay that wasn't the last one the last one was regarding the assistant text to speech can you now send me that in a text version?"
14,Assistant,,"Clarified and confirmed Azure file text: 'This is a test message.'"
15,User,2026-04-02T09:19:23.850Z,"Okay no worries that's close enough"
16,Assistant,,"Offered re-render options and asked whether user wanted different voice or timestamps."
17,User,2026-04-02T09:20:01.531Z,"have you made any changes to the source code from this conversation?"
18,Assistant,,"Confirmed no source changes; noted two WAV files created in repo."
19,User,2026-04-02T09:21:15.743Z,"okay can you give me a breakdown of the chat sessions we've had today not including any local copilot in Visual Studio code and give me a number of messages for each and time from and to"
20,Assistant,2026-04-02T09:22:13.109Z,"One chat session today (excluding local VS Copilot): 2026-04-02T09:12:18.813Z → 2026-04-02T09:21:15.743Z (≈ 8m57s). Messages: 10 user messages, 13 assistant messages."
21,User,2026-04-02T09:22:13.109Z,"yes please and open in Visual Studio code"
22,Assistant,,"Created this transcript file and opened it in VS Code per request." 
